{
  "evaluationId": "8c9d0e1f-2a3b-4c4d-8e5f-6a7b8c9d0e1f",
  "runId": "5f0c1a2b-3c4d-4e5f-8a9b-0c1d2e3f4a5b",
  "actionId": null,
  "decision": "deny",
  "reasonCode": "resource_out_of_scope",
  "safeMessage": "The proposed action names a record outside the run's passport.",
  "alternativeTemplate": null,
  "controls": [],
  "semantic": null,
  "content": null,
  "catalog": { "admissionRevisionId": 1, "activeRevisionId": 1, "feedRevisionId": 1 }
}
